{
  "$schema": "https://json-schema.org/draft/2020-12/schema",
  "title": "MatXformRequest",
  "type": "object",
  "additionalProperties": false,
  "required": ["contract_version", "request_id", "batch_id", "artifacts"],
  "properties": {
    "contract_version": { "const": "ts-mat-xform-request/v1" },
    "request_id": { "type": "string", "minLength": 1 },
    "batch_id": { "type": "string", "minLength": 1 },
    "artifacts": {
      "type": "array", "minItems": 1,
      "items": {
        "type": "object", "additionalProperties": false,
        "required": ["artifact_id", "relative_path", "utf8_text"],
        "properties": {
          "artifact_id": { "type": "string", "minLength": 1 },
          "relative_path": { "type": "string", "minLength": 1 },
          "utf8_text": { "type": "string" }
        }
      }
    }
  }
}
