{
  "contract_version": "ts-mat-xform-request/v1",
  "request_id": "historical-mat-xform-batch-001",
  "batch_id": "historical-mat-xform-batch-001",
  "artifacts": [
    { "artifact_id": "one", "relative_path": "nested/one.txt", "utf8_text": "café\r\n" },
    { "artifact_id": "two", "relative_path": "two.txt", "utf8_text": "第二\r\n" },
    { "artifact_id": "three", "relative_path": "no-newline.txt", "utf8_text": "no trailing newline" }
  ]
}
